{
  "id": "umbrella_thorn",
  "kind": "tree",
  "author": "Animundo team",
  "name": "Umbrella thorn acacia",
  "latin": "Vachellia tortilis",
  "taxon": {
    "gbif_key": 3974700,
    "rank": "SPECIES",
    "name": "Vachellia tortilis"
  },
  "trunk": {
    "height": [
      5,
      7
    ]
  },
  "crown": {
    "shape": "umbrella",
    "radius": 4.5,
    "thickness": 2
  },
  "colors": {
    "trunk": "#5e4a3a",
    "leaves": "#7d9a48"
  },
  "on": [
    "grass",
    "sand"
  ],
  "sources": [
    "https://en.wikipedia.org/wiki/Vachellia_tortilis",
    "https://www.gbif.org/species/3974700"
  ]
}
