{
  "id": "italian_cypress",
  "kind": "tree",
  "author": "Animundo team",
  "name": "Italian cypress",
  "latin": "Cupressus sempervirens",
  "taxon": {
    "gbif_key": 2684030,
    "rank": "SPECIES",
    "name": "Cupressus sempervirens"
  },
  "trunk": {
    "height": [
      9,
      12
    ]
  },
  "crown": {
    "shape": "column",
    "radius": 1.8,
    "height": 10
  },
  "colors": {
    "trunk": "#6a4e38",
    "leaves": "#2f5a36"
  },
  "on": [
    "grass",
    "rock"
  ],
  "sources": [
    "https://en.wikipedia.org/wiki/Cupressus_sempervirens",
    "https://www.gbif.org/species/2684030"
  ]
}
