{
  "id": "coconut_palm",
  "kind": "tree",
  "author": "Animundo team",
  "name": "Coconut palm",
  "latin": "Cocos nucifera",
  "taxon": {
    "gbif_key": 2735117,
    "rank": "SPECIES",
    "name": "Cocos nucifera"
  },
  "trunk": {
    "height": [
      8,
      11
    ],
    "lean": 2
  },
  "crown": {
    "shape": "palm",
    "fronds": 8,
    "length": 4,
    "droop": 0.7
  },
  "colors": {
    "trunk": "#8c7a5e",
    "leaves": "#4f8f3c"
  },
  "on": [
    "sand",
    "grass"
  ],
  "sources": [
    "https://en.wikipedia.org/wiki/Cocos_nucifera",
    "https://www.gbif.org/species/2735117"
  ]
}
