{
  "id": "baobab",
  "kind": "tree",
  "author": "Animundo team",
  "name": "African baobab",
  "latin": "Adansonia digitata",
  "taxon": {
    "gbif_key": 5406695,
    "rank": "SPECIES",
    "name": "Adansonia digitata"
  },
  "trunk": {
    "height": [
      6,
      8
    ],
    "girth": 3
  },
  "crown": {
    "shape": "round",
    "radius": 3.5,
    "squash": 2.2
  },
  "colors": {
    "trunk": "#9b8a78",
    "leaves": "#6f9a42",
    "autumn": "#b8a24a"
  },
  "on": [
    "grass",
    "sand"
  ],
  "sources": [
    "https://en.wikipedia.org/wiki/Adansonia_digitata",
    "https://www.gbif.org/species/5406695"
  ]
}
